{
  "schema": "infrx.run-profile/1",
  "identity": {
    "run_id": "e4c-box-1-envelope-r1.0",
    "source_sha": "e6a8b40aa2fa10360a8d17e168fb593b3ffce646",
    "deployed_sha": "e6a8b40aa2fa10360a8d17e168fb593b3ffce646",
    "image_digest": "sha256:a02083a5c80d29bc0a56f264179556d4c3323c06cf632063973aafa7bd394751",
    "weights_sha256": "sha256:91a81b77f73b647ff84d32cad09ded838966b1dea605024d1e082ae7f3b20bfc",
    "tokenizer_sha256": "sha256:06b9509352d2af50381ab2247e083b80d32d5c0aba91c272ca9ff729b6a0e523",
    "processor_sha256": "sha256:d89ef49ce9cd37fbf510158e13c1ef063d9286411c1ec9049932dbe0487143b1",
    "template_sha256": "sha256:273d8e0e683b885071fb17e08d71e5f2a5ddfb5309756181681de4f5a1822d80",
    "model_revision": "nemostation/marlin-2b@2026-09-01",
    "preparation_profile": "v1",
    "engine_options": {
      "max_num_seqs": 8,
      "max_video_seconds": 82
    },
    "migration_version": "0059",
    "config_version": "sha256:664b761839a67103272b79e1907ed4b1dd0aa56ebf15353dbc68d675d98ffc26"
  },
  "target": {
    "path": "direct-gateway",
    "allowlist": [
      "127.0.0.1:8001"
    ],
    "environment_owner": "coordinator (pilot box i-0e8449a4ffca29bab)",
    "allowed_fault_targets": [
      "marlin2b-vllm",
      "infrx-worker",
      "infrx-valkey"
    ],
    "tenant_key_env": [
      "INFRX_API_KEY"
    ],
    "test_key_ids": [
      "142c7d81"
    ],
    "customer_traffic": false,
    "maintenance_window": "e4c-side-e6a8b40a-20261002T0005Z"
  },
  "bounds": {
    "max_duration_s": 14700,
    "max_requests": 3600,
    "max_input_bytes": 14000000000,
    "max_input_tokens_per_request": 30720,
    "max_output_tokens_per_request": 1024,
    "max_output_tokens": 3686400,
    "max_concurrency": 64,
    "max_drain_s": 600,
    "spend": {
      "currency": "CREDIT",
      "max_spend": 50000,
      "outstanding_holds": 0,
      "rates": {
        "input_per_mtok": 400,
        "output_per_mtok": 1200,
        "source": "P-01 card rc_marlin2b_20260925_launch, 400.00000000 / 1200.00000000 CREDIT per 1M input / output tokens (research/plan/15-pending-inputs.md, Decisions 2026-09-25)",
        "as_of": "2026-09-25"
      }
    },
    "stop_thresholds": {
      "platform_error_rate": 0.01,
      "host_growth_mib": 512,
      "gpu_growth_mib": 256
    }
  },
  "workload": {
    "manifest_sha256": "386a2d89c26c1bbff4df03004239b3153651901ffcda76f36c3ce5fc23095e18",
    "data_source": "E1 licensed corpus (CC-BY / public domain), models/marlin2b/corpus/manifest.json e1-2026-09-20",
    "item_ids": [
      "c000-bbb1080p30-1080p-16x9",
      "c001-tos720p-720p-16x9",
      "c002-sintel1080p-480p-16x9",
      "c003-nasasteve-360p-16x9",
      "c004-bbb1080p30-1080x1920-portrait",
      "c005-tos720p-720x1280-portrait",
      "c006-sintel1080p-480x854-portrait",
      "c007-nasasteve-1080-square",
      "c008-bbb1080p30-512-square",
      "c009-tos720p-2560x1080-ultrawide",
      "c010-sintel1080p-1920x800-scope",
      "c011-nasasteve-640x480-4x3",
      "c012-bbb1080p30-1024x768-4x3",
      "c013-tos720p-1920x480-extreme-wide",
      "c014-sintel1080p-480x1920-extreme-tall",
      "c015-nasasteve-240p-tiny",
      "c016-bbb1080p30-1080p-16x9",
      "c017-tos720p-720p-16x9",
      "c018-sintel1080p-480p-16x9",
      "c019-nasasteve-360p-16x9",
      "c020-bbb1080p30-1080x1920-portrait-rot90cw",
      "c021-tos720p-720x1280-portrait",
      "c022-sintel1080p-480x854-portrait",
      "c023-bbb1080p30-1080-square",
      "c024-bbb1080p30-512-square",
      "c025-tos720p-2560x1080-ultrawide-rot180",
      "c026-sintel1080p-1920x800-scope",
      "c027-nasasteve-640x480-4x3",
      "c028-bbb1080p30-1024x768-4x3",
      "c029-tos720p-1920x480-extreme-wide",
      "c030-sintel1080p-480x1920-extreme-tall-rot90ccw",
      "c031-bbb1080p30-240p-tiny",
      "c032-bbb1080p30-1080p-16x9",
      "c033-tos720p-720p-16x9",
      "c034-sintel1080p-480p-16x9",
      "c035-bbb1080p30-360p-16x9",
      "c036-bbb1080p30-1080x1920-portrait",
      "c037-tos720p-720x1280-portrait",
      "c038-sintel1080p-480x854-portrait",
      "c039-bbb1080p30-1080-square",
      "c040-bbb1080p30-512-square",
      "c041-tos720p-2560x1080-ultrawide",
      "c042-sintel1080p-1920x800-scope",
      "c043-bbb1080p30-640x480-4x3",
      "c044-bbb1080p30-1024x768-4x3",
      "c045-tos720p-1920x480-extreme-wide",
      "c046-sintel1080p-480x1920-extreme-tall",
      "c047-bbb1080p30-240p-tiny",
      "c048-bbb1080p30-1080p-16x9",
      "c049-tos720p-720p-16x9",
      "c050-sintel1080p-480p-16x9",
      "c051-tos720p-360p-16x9",
      "c052-bbb1080p30-1080x1920-portrait",
      "c053-tos720p-720x1280-portrait",
      "c054-sintel1080p-480x854-portrait",
      "c055-bbb1080p30-1080-square",
      "c056-bbb1080p30-512-square",
      "c057-tos720p-2560x1080-ultrawide",
      "c058-sintel1080p-1920x800-scope",
      "c059-bbb1080p30-640x480-4x3",
      "c060-bbb1080p30-1024x768-4x3",
      "c061-tos720p-1920x480-extreme-wide",
      "c062-sintel1080p-480x1920-extreme-tall",
      "c063-tos720p-240p-tiny"
    ],
    "dataset_version": "e4b-e6a8b40-20261002T021133Z-envelope-r1.0",
    "seed": 20260922,
    "forms": [
      "video_b64"
    ],
    "max_tokens_mix": [
      128,
      512,
      1024
    ],
    "max_clip_duration_s": 82,
    "transport": "sse",
    "tenants": 1,
    "expected_invalid": [
      "c012-bbb1080p30-1024x768-4x3",
      "c025-tos720p-2560x1080-ultrawide-rot180",
      "c038-sintel1080p-480x854-portrait",
      "c051-tos720p-360p-16x9"
    ]
  },
  "measurement": {
    "profile_class": "P1",
    "client": {
      "location": "pilot box, same host as the gateway",
      "resources": "one process",
      "clock": "time.perf_counter, one process"
    },
    "arrival": "open-loop",
    "rate_per_s": 1.0,
    "concurrency": null,
    "warmup_excluded": true,
    "cache_regime": "unknown",
    "max_driver_lag_s": 1.0,
    "min_samples": 60,
    "repeats": 1,
    "thresholds": {
      "ttft_s": 6.0,
      "e2e_s": null,
      "max_error_rate": 0.01
    },
    "fault_schedule": [],
    "telemetry": [],
    "price": {
      "usd_per_hour": 2.24208,
      "instances": 1,
      "source": "AWS on-demand price sheet us-east-1 Linux g6e.2xlarge (research/production-api/08-cost-model-and-unit-economics.md:181; P-19)",
      "as_of": "2026-09-20"
    }
  },
  "cleanup": {
    "policy": "drain-then-cancel",
    "owned_prefix": "infrx-e4c-",
    "restore": "no target state changes except test-tenant jobs/ledger rows; uploads and results expire with their TTLs",
    "max_cleanup_s": 900,
    "evidence_destination": "models/marlin2b/results/E4C-box-<release7>/"
  }
}